{"bounded_launch_authority":{"bootstrap_identifier":"bounded-streaming-worker-bootstrap-v1","bootstrap_path":"src/orev3/execution/bounded_streaming_worker_bootstrap.py","bootstrap_request_identity_domain":"orev3:bounded-streaming-worker-bootstrap-request:v1\n","bootstrap_request_max_bytes":4194304,"cwd_policy":"cwd-ignored-absolute-fd-authority-v1","measurement_wrapper_identifier":"darwin-time-measurement-wrapper-v1","measurement_wrapper_identity":"09cc63835b888387783d32d0011fd0a0d344c3ba9620a947dfabd5bcfd521201","spawn_mechanism":"darwin-os-posix-spawn-file-actions-v1"},"limits":{"deferred_numeric_fields":["max_controller_peak_rss_bytes","max_projection_bytes","max_temporary_disk_bytes","max_worker_peak_rss_bytes","watchdog_poll_interval_milliseconds","watchdog_rss_bytes"],"max_aggregate_collection_bytes":1749809411,"max_collection_members":256,"max_controller_peak_rss_bytes":{"status":"measurement_pending"},"max_file_bytes":227867665,"max_open_files":256,"max_processes":16,"max_projection_bytes":328739211471540,"max_replay_units":100000,"max_source_records":1442676,"max_stderr_bytes":1048576,"max_stdout_bytes":1048576,"max_subprocess_seconds":600,"max_temporary_disk_bytes":657480406911612,"max_worker_peak_rss_bytes":{"status":"measurement_pending"},"numeric_envelope_mode":"BOUNDED_STREAMING_MEASUREMENT_CANDIDATE","watchdog_poll_interval_milliseconds":{"status":"measurement_pending"},"watchdog_rss_bytes":{"status":"measurement_pending"}},"policy_identifier":"experiment-evidence-preparation-policy-bounded-streaming-v1","policy_identity":"e8d05be3129135535dbc9a8575cae0f32934b3a8e8773f84f3d7bbd0610ee61f","policy_revision":"1","profile_renderer_identity":"1666f302d171d7f062583852cacc623a509f1fc7d1d73910f4085bb9a21732df","schema_version":1,"worker_profiles":[{"allowed_read_roles":["closed_dependencies","detached_source","exact_raw_input","private_request","system_runtime"],"allowed_write_roles":["private_output","private_temp"],"commands":["project_canonical_jsonl"],"denied_roles":["attempt_control_roots","mutable_input_locators","network","projector_unrelated_raw_objects","ranking_evaluation_roots"],"module":"src/orev3/execution/input_projection_worker.py","network_policy":"prohibited","sandbox_template_identity":"da32e88508820e8034d1ab8570b9fdbbf0f85a9817a5401a8821c7ef4a215d7c","sandbox_template_revision":"macos-seatbelt-capability-v4","worker_kind":"INPUT_PROJECTOR"},{"allowed_read_roles":["artifact_store","detached_source","private_request","system_runtime"],"allowed_write_roles":["closed_dependency_root","private_temp"],"commands":["validate_imports","validate_runtime"],"denied_roles":["network","phase3b_scientific_inputs"],"module":"src/orev3/execution/preparation_worker.py","network_policy":"prohibited","sandbox_template_identity":"e55dba9a5ec1fb87d8237cd95c8a29dd49c0919fc7380c38678ee6669a3ed7bc","sandbox_template_revision":"phase3a-network-sandbox-v1","worker_kind":"PHASE3A_VALIDATOR"},{"allowed_read_roles":["closed_dependencies","detached_source","private_request","system_runtime"],"allowed_write_roles":["private_temp"],"commands":["collect","run_exact"],"denied_roles":["attempt_control_roots","mutable_input_locators","network","projection_store","raw_input_store"],"module":"src/orev3/execution/readiness_test_worker.py","network_policy":"prohibited","sandbox_template_identity":"8c658cb44644339b66664c180412425ca6e4b0f8c4f8e69b57839cc811c3c1ab","sandbox_template_revision":"macos-seatbelt-capability-v4","worker_kind":"READINESS_TEST"},{"allowed_read_roles":["closed_dependencies","detached_source","exact_projection","private_request","system_runtime"],"allowed_write_roles":["private_output","private_temp"],"commands":["reconstruct_replay"],"denied_roles":["attempt_control_roots","mutable_input_locators","network","projector_private_temp","raw_input_store","raw_parser_capability","unrelated_projection_objects"],"module":"src/orev3/execution/replay_preparation_worker.py","network_policy":"prohibited","sandbox_template_identity":"b8d06f8178a51f31a9156f466af1391c0fadac43450f2d0ba85195219dc1f514","sandbox_template_revision":"macos-seatbelt-capability-v4","worker_kind":"REPLAY_PREPARATION"}]}
